Term,Definition
hemochromatosis,excess iron in the body
hemodynamic measurement,test to measure blood flow
hemolysis,breakdown in red blood cells
hemolytic anemia,destruction of red blood cells
hemoperitoneum,blood in the abdominal cavity
hemophilia,blood clotting disorder
hemopneumothorax,air and blood in the chest cavity
hemoptysis,coughing up blood
hemorrhage,bleeding
hemorrhoids,swollen anal veins
hemothorax,blood in the chest cavity
heparin lock,needle placed with blood thinner to keep blood from clotting inside the needle or tubing
hepatic,liver
hepatic encephalopathy,brain damage due to liver failure
hepatitis,inflammation of the liver
hepatocellular carcinoma,liver cancer
hepatoma,cancer or tumor of the liver
hepatomegaly,enlarged liver
hepatopathy,liver disease
hepatosplenomegaly,enlarged liver and spleen
heritable disease,a disease which can be passed to children resulting in damage to future children
hernia,organ protrusion
herniated disc,slipped or ruptured spinal disc
herpes simplex,cold sores or genital herpes
herpes zoster,shingles
hirschsprung's disease,missing nerve cells in the colon
histopathologic,pertaining to disease of body tissues or cells
histoplasmosis,fungal infection from bird or bat droppings
history positive,in past medical history; that you have ever had
hiv,human immunodeficiency virus
hodgkin's lymphoma,type of lymphatic cancer
hordeolum,stye
huntington’s disease,progressive brain disorder
hydatidiform mole,abnormal growth in the uterus
hydrocele,fluid accumulation in the scrotum
hydrocephalus,fluid buildup in the brain
hydronephrosis,swelling of the kidney
hydrosalpinx,fluid in the fallopian tube
hydrothorax,fluid in the chest cavity
hyperbilirubinemia,high bilirubin levels
hypercalcemia,high calcium levels
hypercapnia,high carbon dioxide levels
hyperchloremia,high chloride levels
hypercholesterolemia,high cholesterol levels
hyperemesis gravidarum,severe nausea during pregnancy
hyperglycemia,high blood sugar
hyperglycemic hyperosmolar state,severe high blood sugar
hyperhidrosis,excessive sweating
hyperkalemia,high potassium levels
hyperlipidemia,high levels of fat in the blood
hypermagnesemia,high magnesium levels
hypernatremia,high blood sodium level
hyperopia,farsightedness
hyperosmia,increased sensitivity to smell
hyperosmolar hyperglycemic state,severe dehydration from high blood sugar
hyperoxia,too much oxygen in the blood
hyperparathyroidism,overactive parathyroid glands
hyperphosphatemia,high phosphate levels
hyperpnea,deep or rapid breathing
hyperprolactinemia,high prolactin levels
hypersensitivity pneumonitis,inflammation due to allergic reaction
hypertension,high blood pressure
hyperthyroidism,overactive thyroid
hypertrichosis,excessive hair growth
hypertriglyceridemia,high levels of triglycerides
hypertrophic cardiomyopathy,thickened heart muscle
hyperuricemia,high uric acid levels
hyperventilation,breathing too fast
hypervolemia,high blood volume
hyphema,blood in the eye
hypoalbuminemia,low albumin in the blood
hypocalcemia,low blood calcium level
hypocapnia,low carbon dioxide levels in the blood
hypochloremia,low chloride levels
hypocholesterolemia,low cholesterol levels
hypogeusia,reduced sense of taste
hypoglycemia,low blood sugar
hypohidrosis,decreased sweating
hypokalemia,low blood potassium level
hypomagnesemia,low magnesium levels
hyponatremia,low blood sodium level
hypoparathyroidism,underactive parathyroid glands
hypophosphatemia,low phosphate levels
hypopituitarism,pituitary gland underactivity
hypopnea,shallow breathing
hypospadias,urethral opening on the underside of the penis
hypotension,low blood pressure
hypothesis,a testable statement of how two or more variables are expected to be related to one another
hypothyroidism,underactive thyroid
hypoventilation,breathing too slow
hypovolemia,low blood volume
hypovolemic shock,shock due to blood or fluid loss
hypoxemia,a decrease of oxygen in the blood
hypoxia,low oxygen level in the blood
hysterectomy,removal of the womb
hysteroscopy,procedure to view the uterus
iatrogenic,caused by a physician or by treatment
idiopathic,of unknown cause
idiopathic pulmonary fibrosis,scarring of the lungs
iga nephropathy,kidney inflammation due to iga deposits
immobilization,unable to move
immunity,"defense against, protection from"
immunization,administration of a substance to prevent disease
immunoglobin,a protein that makes antibodies
immunological,relating to the body's ability to fight infection
immunological effects,effect on the immune system
immunosuppressive,drug which suppresses the body's immune response
immunotherapy,drug to help the body's immune system
impaired function,abnormal function
impetigo,bacterial skin infection
implantation,operation to place a device inside the body
incapacity,"refers to a person's mental status and means inability to understand information presented, to appreciate the consequences of acting (or not acting) on that information, and to make a choice"
incision,cut
inclusion/exclusion criteria,the medical or social standards determining whether a person may or may not be allowed to enter a clinical trial
incompetence,used as a legal term to indicate the inability to manage one's own affairs
incompetent cervix,weak cervix causing preterm birth
indicated,suggested; necessary
induce,cause
induction,start
induction phase,beginning phase or stage of treatment
induration,hardening
indwelling,"remaining in a given location, such as a catheter"
inert,not active; substance that doesn't affect you
infarct,death of tissue due to lack of blood supply
infectious disease,disease transmitted from person to person
inflammation,swelling
inflation,to put air in
informed consent,the process of learning the key facts about a clinical trial before deciding whether or not to participate
infused,to drip in; to put in
infusion,"slow injection of a substance into the body, usually into the blood by means of a catheter"
ingest,swallow; eat or drink
ingestion,eating; taking by mouth
inject,to put into by way of a needle or other device
insomnia,unable to sleep
instilled,put into; drip into
institutionalized,"confined, either voluntarily or involuntarily (e.g., a hospital, prison, or nursing home)"
insulin resistance,reduced sensitivity to insulin
intensity,degree; amount
interferon,agent that acts against viruses
intermittent,alternately stopping and starting
"interstitial
pneumonitis, pneumonitis","inflammation of the lungs, which can cause shortness of breath and difficulty breathing"
interstitial lung disease,group of lung diseases causing scarring of lung tissue
intervention,includes both physical procedures by which data are gathered and manipulations of the participant or the participant's environment that are performed for research purposes
intracatheter,small tube in a vein
intramuscular,into the muscle; within the muscle
intramuscular injection,to put into the muscle with a needle
intraperitoneal,into the abdominal cavity
intrathecal,into the spinal fluid
intravenous,in the blood vessel
intravenous (iv),through the vein
intravenous infusion,to drip into the blood vessel through a plastic tube and needle
intravesical,in the bladder
intubate,the placement of a tube into the airway
intussusception,part of the intestine slides into another
invasive procedure,"puncturing, opening, or cutting the skin"
investigational method,a treatment method which has not been proven to be beneficial or has not been accepted as standard care
investigator,the individual(s) designated to have the appropriate level of authority and responsibility to direct the research project and/or activity
iron-deficiency anemia,low iron levels
irradiation,x-ray
irritable bowel syndrome (ibs),chronic digestive disorder causing pain
ischemia,decreased oxygen in a tissue (usually because of decreased blood flow)
ischemic colitis,reduced blood flow to the colon
isolated,to separate; to close off
jaundice,yellowing of the skin
kaposi's sarcoma,cancer that causes skin lesions
keratitis,cornea inflammation
keratoconus,thinning of the cornea
keratosis pilaris,small bumps on the skin
korsakoff syndrome,memory disorder from alcohol abuse
kyphosis,hunched back
labyrinthitis,inflammation of the inner ear
lactating,making breast milk
lactose intolerance,inability to digest lactose
laparotomy,surgical procedure in which an incision is made in the abdominal wall to enable a doctor to look at the organs inside.
laporatomy,incision in the abdominal wall to allow a physician to look at the organs
laryngectomy,removal of the larynx
laryngitis,inflammation of the voice box
laryngospasm,spasms of the vocal cords
"legally authorized representative
(lar)",a person authorized either by statute or by court appointment to make decisions on behalf of another person
lesion,site of the injury; site of the disease
lethargy,sleepiness
leukemia,cancer of the blood
leukocyte,blood cells that fight infection
leukocytosis,high white blood cell count
leukopenia,low white blood cell count
leukoplakia,white patches inside the mouth
libido,sexual desire; sex drive
lichen planus,chronic inflammatory skin condition
lichenification,thickening of the skin
lipid,fat
lipodystrophy,abnormal fat distribution
lipoma,fatty tumor
local anesthesia,"creation of insensitivity to pain in a small, local area of the body, usually by injection of numbing drugs"
local anesthetic,medicine to numb an area of the body
localized,restricted to one area
long qt syndrome,prolonged heart rhythm intervals
longitudinal study,a study in which data are collected from the same sample at least two different times
lordosis,excessive inward curve of the spine
low blood sugar / hypoglycemia,"abnormal decrease in sugar in the blood, which can cause weakness, fatigue, and if severe, can cause loss of consciousness"
low thyroid function,"may cause fatigue, weight gain, fluid retention, feeling cold, decreased cognitive function"
low white cell count,increased risk of infection
lumbar puncture,spinal tap; a needle inserted between the bones of the spine to put in a drug or take a sample of fluid
lumbosacral,lower back
lumen,"the cavity of an organ or tube (e.g., blood vessel)"
lyme disease,infection from tick bite
lymphangiography,an x-ray of the lymph nodes or tissues after injection of dye in lymph vessels
lymphedema,swelling due to lymphatic blockage
lymphocyte,a type of white blood cell
lymphoma,a cancer of the lymph nodes or tissues
macroglossia,enlarged tongue
macular degeneration,loss of central vision
macules,"flat, discolored spots on the skin"
maintenance dose,the usual daily dose
major depressive disorder,persistent sadness
malaise,"a vague feeling of discomfort, feeling bad"
malaria,parasitic infection from mosquitoes
malfunction,condition in which something is not functioning properly
malignancy,tumor; cancer
mallory-weiss tear,tear in the esophagus from vomiting
malrotation,abnormal rotation of the intestine
manifested,showed
marfan syndrome,genetic disorder affecting connective tissue
mastitis,breast tissue infection
mastoiditis,infection of the mastoid bone
mature minor,someone who has not reached adulthood (as defined by state law) but who may be treated as an adult for certain purposes (e.g. consenting to medical care)
meckel’s diverticulum,abnormal pouch in the intestine
meconium ileus,obstruction in the intestine of a newborn
medial collateral ligament (mcl) tear,torn ligament in the knee
medullablastoma,a type of brain tumor
medullobastoma,type of brain tumor
medulloblastoma,brain cancer in children
megaloblastosis,change in red blood cells
melanoma,skin cancer
melasma,dark skin patches
melena,"black, tarry stool"
meniere’s disease,inner ear disorder causing vertigo
meningitis,infection or irritation around the brain
meningoencephalitis,inflammation of the brain and its lining
meniscus tear,torn cartilage in the knee
menorrhagia,heavy menstrual bleeding
merkel cell carcinoma,rare skin cancer
mesothelioma,cancer caused by asbestos
metabolic acidosis,the body becomes more acid
metabolism,chemical changes which provide energy
metabolize,process of breaking down substances in the cells to obtain energy
metastasis,spread of cancer cells from one part of the body to another
metastasize,spread
metatarsalgia,pain in the ball of the foot
metronidazole,"drug used to treat infections caused by parasites (invading organisms that take up living in the body) or other causes of anaerobic infection (not requiring oxygen to survive) mi myocardial infarction, heart attack"
migraine,severe headache
minimal,slight
minimal risk,"a risk is minimal where the probability and magnitude of harm or discomfort anticipated in the proposed research are not greater, in and of themselves, than those ordinarily encountered in daily life or during the performance of routine physical or psychological examinations or tests"
miscarriage,pregnancy loss
mitral valve prolapse,improper closure of the mitral valve
moderate risk,a risk is moderate when it includes non-public behavior or data and/or allows for connection of the response to the individual's identity
molar pregnancy,abnormal pregnancy with a non-viable embryo
molluscum contagiosum,skin infection causing round bumps
monitor,check on; keep track of; watch carefully
monitoring,"the collection and analysis of data as the project progresses to assure the appropriateness of the research, its design and participant protections"
mononucleosis,viral infection causing fatigue and swollen glands
morbidity,undesired result or complication
mortality,death
morton's neuroma,thickening of tissue around a foot nerve
motility,the ability to move
mucosa,the lining inside the ( )
"mucosa, mucous membrane","moist lining of digestive, respiratory, reproductive, and urinary tracts"
mucositis/stomatitis,"sores in the mouth and esophagus, which may be painful and cause difficulty swallowing"
muga,procedure using a special camera to look at the heart after radioactive dye has been put into it through one of the veins
multiple myeloma,cancer of plasma cells in bone marrow
multiple sclerosis,disease of the central nervous system
myalgia,muscle aches
myasthenia gravis,autoimmune muscle weakness disorder
mycosis fungoides,skin lymphoma
myelodysplastic syndrome,bone marrow disorder
myelofibrosis,scarring of the bone marrow
myocardial,pertaining to the heart muscle
myocardial infarction,heart attack
myocarditis,inflammation of the heart muscle
myoclonus,sudden muscle jerks
myoglobinuria,myoglobin in urine (muscle breakdown)
myopia,nearsightedness
myositis,muscle inflammation
nasal,nose
nasal congestion,stuffiness of the nose
nasal polyps,non-cancerous growths in the nasal passages
nasogastric tube,tube from the nose to the stomach
nausea,feel sick to the stomach
necrosis,death of tissue
necrotizing fasciitis,flesh-eating bacterial infection
neoplasia,"tumor, may be non-cancerous or cancerous"
neoplasia/neoplasm,"tumor, may be benign or malignant"
nephrectomy,kidney removal
nephrolithiasis,kidney stones
nephropathy,kidney disease
nephrotic syndrome,kidney disorder causing protein loss in urine
neuroblastoma,cancer of nerve tissue
neurologic deficits,"a neurologic deficit is a decrease in the function of the brain, spinal cord, muscles, and/or nerves"
neurological,pertaining to the nervous system
neurological exam,"test of brain, spinal cord, and reflexes"
neuropathy,"damage to the nerves which can cause numbness, pain, and weakness"
neutropenia,decrease in the main part of the white blood cells
neutrophilia,high levels of neutrophils (white blood cells)
new indication,new use
ng tube (nasogastric),a flexible plastic tube that is passed through the nose or mouth and into the stomach
nocturia,excessive urination at night
nodules,solid lumps
non-hodgkin's lymphoma,lymphatic system cancer
non-invasive,"not breaking, cutting or entering the skin"
noninvasive,"not breaking, cutting, or entering the skin"
nosocomial,acquired in the hospital
nosocomial pneumonia,pneumonia acquired in the hospital
null hypothesis,"the proposition, to be tested statistically, that the experimental intervention has ""no effect,"" meaning that the treatment and control groups will not differ as a result of the intervention"
nystagmus,uncontrolled eye movements
obsessive-compulsive disorder (ocd),repeated unwanted thoughts/actions
occlusion,closing; obstruction
occult blood test,a test for small amounts of blood in the stool
odynophagia,painful swallowing
off-label use,a drug prescribed for conditions other than those approved by the fda.
oligohydramnios,low amniotic fluid
oligomenorrhea,infrequent periods
oliguria,low urine output
omphalocele,abdominal organs protruding through the belly button
oncology,the study of tumors or cancer
onycholysis,separation of the nail from the nail bed
onychomycosis,fungal infection of the nail
oophorectomy,surgical removal of the ovaries
open design,an experimental design in which both the investigator(s) and the participants know the treatment group(s) to which participants are assigned
open-ended questions,survey questions that allow respondents to answer in their own words
open-label,"a study in which the drug, device, procedure is known to patient and investigator"
open-label trial,a clinical trial in which doctors and participants know which drug or vaccine is being administered
ophthalmic,pertaining to the eye
opportunistic infections,"an infection caused by an organism that usually does not cause illness, but causes disease when a person's immune response (resistance) to infection is impaired"
optic neuritis,inflammation of the optic nerve
"optimum, optimal",best
oral,by mouth
oral administration,by mouth
oral thrush,fungal infection in the mouth
orchitis,testicle inflammation
orphan drugs,an fda category that refers to medications used to treat diseases and conditions that occur rarely
orthopedic,pertaining to the bones
orthopnea,difficulty breathing while lying down
orthostatic hypotension,drop in blood pressure when standing up
ostealgia,bone pain
osteoarthritis,bone and joint pain
osteogenesis imperfecta,brittle bone disease
osteomalacia,softening of the bones
osteomyelitis,bone infection
osteopenia,low bone density
osteopetrosis,bone disorder characterized by dense bone
osteoporosis,softening of the bones
osteosarcoma,bone cancer
osteosclerosis,abnormal hardening of bone
otitis externa,outer ear infection (swimmer's ear)
otitis media,middle ear infection
ovaries,female sex glands
over-the-counter drugs,medications that you can buy without a doctor's prescription
overnight fast,do not eat or drink after ( ) p.m.
paget's disease,abnormal bone destruction and regrowth
pallor,pale skin
palpitation,rapid heart beat parameter measure
palpitations,irregular heart beats that you can feel
pancreatitis,inflammation of the pancreas
pancreatitis / inflammation of the pancreas,inflammation of the pancreas causing pain in the upper abdomen
pancytopenia,abnormal decrease in the levels of all type of blood cells
panic disorder,sudden episodes of intense fear
panniculitis,inflammation of fat tissue under the skin
papilledema,swelling of the optic nerve
papules,"raised, solid pimples"
paraphimosis,inability to return the foreskin to its normal position
parenteral,given by injection
paresthesia,tingling in the ( )
parkinson's disease,progressive neurological disorder
parkinsonism,symptoms similar to parkinson’s disease
paronychia,infection around the nail
parosmia,distorted sense of smell
paroxysmal nocturnal dyspnea,sudden breathlessness at night
partial seizure,seizure
participant,individuals whose physiological or behavioral characteristics and responses are the object of study in a research project
patellar tendinitis,inflammation of the tendon in the knee
patency,condition of being open
patent ductus arteriosus,persistent opening between heart vessels in infants
paternalism,making decisions for others against or apart from their wishes with the intent of doing them good
pathogenesis,the initial cause of a disease
pediculosis,lice infestation
peer review,review of a clinical trial by experts chosen by the study sponsor
pelvic inflammatory disease,infection of the female reproductive organs
peptic stricture,narrowing of the esophagus
peptic ulcer,stomach ulcer
perception,view
percutaneous,through the skin
perforation,hole; tear
pericarditis,inflammation of the heart lining
periodontitis,severe gum infection
peripheral,not central
peripheral artery disease,narrowing of arteries in limbs
peripheral blood,vein blood
peritonitis,inflammation of the abdominal lining
peritonsillar abscess,pus-filled swelling near the tonsils
pernicious anemia,vitamin b12 deficiency
pes cavus,high arches
pes planus,flat feet
pet (positron emission tomography),special camera that uses radiation to look at the structure and functioning of parts of the body
petechiae,small red or purple spots on the skin
peyronie’s disease,curved penis during erection
pharmacokinetics,study of the what the body does to the drug
pharmacological,effect of the drug
pharyngitis,sore throat
phenotype,the physical manifestation of a gene function
pheochromocytoma,tumor of the adrenal gland
phimosis,tight foreskin
phlebitis,inflammation of a vein
physiologically capable,able to function
pilonidal abscess,infected cyst near the tailbone
pilonidal cyst,cyst at the base of the tailbone
pityriasis rosea,temporary skin rash
placebo,a pill that does not contain active medicine
placebo effect,"a physical or emotional change, occurring after a substance is taken or administered, that is not the result of any special property of the substance"
placenta,afterbirth
placenta previa,placenta covering the cervix
placental abruption,premature separation of the placenta
plantar fasciitis,heel pain due to inflammation
plaques,"elevated, scaly patches"
plasma,blood
platelet,part of blood that causes clots
platelets,small particle in the blood that help with blood clotting
pleural effusion,"collection of fluid around the lungs in the chest cavity, which can cause shortness of breath and may require treatment"
pleuritis,inflammation of the lining of the lungs
pleurodesis,procedure to prevent fluid buildup around the lungs
pleurodynia,chest pain due to inflamed pleura
pneumoconiosis,lung disease from inhaling dust
pneumomediastinum,air in the space between the lungs
pneumonia,lung infection
pneumonitis,inflammation of lung tissue
pneumothorax,collapsed lung
polycystic ovarian syndrome,hormonal disorder in women
polycythemia,high red blood cell count
polycythemia vera,overproduction of red blood cells
polydipsia,excessive thirst
polyhydramnios,excess amniotic fluid
polymyalgia rheumatica,muscle pain and stiffness
polymyositis,muscle inflammation
polyps,abnormal lumps that can sometimes be cancerous
polyuria,excessive urination
population,"the entire group (or set or type) of people from which a researcher samples, and to which she or he would ideally like to generalize"
portal hypertension,high blood pressure in the liver veins
post-traumatic stress disorder,anxiety due to trauma
potential,possible
potentiate,increasing effect of a drug by administration of another drug at the same time
potentiator,agent that helps another agent work better
pre-eclampsia,high blood pressure during pregnancy
preclinical,refers to the testing of experimental drugs in the test tube or in animals - the testing that occurs before trials in humans may be carried out
predictive value,expected value
prenatal,before birth
presbycusis,age-related hearing loss
presbyopia,age-related farsightedness
prevention trials,refers to trials to find better ways to prevent disease in people who have never had the disease or to prevent a disease from returning
primary biliary cirrhosis,inflammation of bile ducts in the liver
privacy,"a person's capacity to control the extent, timing, and circumstances of shared oneself (physically, behaviorally, or intellectually) with others"
private information,"includes information about behavior that occurs in a context in which an individual can reasonably expect that no observation or recording is taking place, and information which has been provided for specific purposes by an individual and which the individual can reasonably expect will not be made public"
probability sample,a subset of the population chosen in such a way that every member of the population has a known (nonzero) chance of being selected into the sample
prognosis,"outlook, probable outcomes"
pronation,turning the palm downward
prone,lying on the stomach
prophylaxis,use of drugs to prevent disease
prorated compensation,less if you do not complete the study
prospective studies,studies designed to observe outcomes or events that occur after the group of participants has been identified. prospective studies do not have to involve manipulation or intervention but may be purely observational or involve only the collection of data instead.
prospective study,study following patients forward in time
prostatitis,inflammation of the prostate gland
prosthesis,artificial limbs
protected health information,"name, address, elements of dates related to an individual (e.g., birthdate), email address, numbers; telephone, fax, social security, medical record, health beneficiary/health insurance, certificate or license numbers, vehicle, account numbers, characteristics, or codes (e.g., global positioning system (gps) readings), web urls, internet protocol (io) addresses, biometric identifiers (e.g. voice, fingerprints), full face photographs or comparable images"
proteinuria,excess protein in the urine
protocol,a study plan on which all clinical trials are based
proximal,closer to the center of the body
pruritis,itchy skin
pruritus,itching
pseudohypoparathyroidism,body resistant to parathyroid hormone
psoriasis,chronic skin condition
psychosis,nervous breakdown
psychosocial test,test of your behavior
pulmonary,lung
pulmonary edema,fluid in the lungs
